{
  "schemaVersion": "hacp-0.2-draft",
  "recordKind": "hacp.match_proof",
  "matchProofId": "match_proof_example_0001",
  "createdAt": "2026-05-11T12:11:00Z",
  "authorityPacketId": "packet_example_0001",
  "handoffPackageId": "handoff_example_0001",
  "adapterReportId": "report_example_0001",
  "authorityPacketDigest": {
    "algorithm": "sha256",
    "canonicalization": "json-rfc8785-jcs",
    "digestDomain": "authority_packet_v0.2",
    "value": "aaaaaaaaaaaaaaaaaaaaaaaaaaaaaaaaaaaaaaaaaaaaaaaaaaaaaaaaaaaaaaaa"
  },
  "handoffPackageDigest": {
    "algorithm": "sha256",
    "canonicalization": "json-rfc8785-jcs",
    "digestDomain": "handoff_package_v0.2",
    "value": "bbbbbbbbbbbbbbbbbbbbbbbbbbbbbbbbbbbbbbbbbbbbbbbbbbbbbbbbbbbbbbbb"
  },
  "adapterReportDigest": {
    "algorithm": "sha256",
    "canonicalization": "json-rfc8785-jcs",
    "digestDomain": "adapter_report_v0.2",
    "value": "cccccccccccccccccccccccccccccccccccccccccccccccccccccccccccccccc"
  },
  "matchMethod": "handoff_package_digest",
  "reviewConditions": [],
  "digest": {
    "algorithm": "sha256",
    "canonicalization": "json-rfc8785-jcs",
    "digestDomain": "match_proof_v0.2",
    "value": "dddddddddddddddddddddddddddddddddddddddddddddddddddddddddddddddd"
  }
}
