{
  "schemaVersion": "hacp-0.2-draft",
  "recordKind": "hacp.match_proof",
  "matchProofId": "match_proof_boundary_breach_example_0001",
  "createdAt": "2026-05-11T12:33:00Z",
  "authorityPacketId": "packet_example_0001",
  "handoffPackageId": "handoff_example_0001",
  "adapterReportId": "report_example_boundary_breach_0001",
  "authorityPacketDigest": {
    "algorithm": "sha256",
    "canonicalization": "json-rfc8785-jcs",
    "digestDomain": "authority_packet_v0.2",
    "value": "aaaaaaaaaaaaaaaaaaaaaaaaaaaaaaaaaaaaaaaaaaaaaaaaaaaaaaaaaaaaaaaa"
  },
  "handoffPackageDigest": {
    "algorithm": "sha256",
    "canonicalization": "json-rfc8785-jcs",
    "digestDomain": "handoff_package_v0.2",
    "value": "bbbbbbbbbbbbbbbbbbbbbbbbbbbbbbbbbbbbbbbbbbbbbbbbbbbbbbbbbbbbbbbb"
  },
  "adapterReportDigest": {
    "algorithm": "sha256",
    "canonicalization": "json-rfc8785-jcs",
    "digestDomain": "adapter_report_v0.2",
    "value": "1717171717171717171717171717171717171717171717171717171717171717"
  },
  "matchMethod": "handoff_package_digest",
  "reviewConditions": ["boundary_breach", "stop_blocked", "residual_risk"],
  "digest": {
    "algorithm": "sha256",
    "canonicalization": "json-rfc8785-jcs",
    "digestDomain": "match_proof_v0.2",
    "value": "1818181818181818181818181818181818181818181818181818181818181818"
  }
}
